{
  "schema_version": "proofkey-analysis-v1",
  "analysis_id": "analysis-1",
  "source": {
    "case_id": "demo-1",
    "revision": 0,
    "snapshot_hash": "5e0afab1a4e4359af9ad37c6a4043890f99c9522492a4ed43eebd2bc26d51727"
  },
  "status": "completed",
  "freshness": "current",
  "run_id": "run-1",
  "result_id": "result-1",
  "review": {
    "status": "unreviewed",
    "reviewer_id": null,
    "reviewed_at": null
  },
  "provenance": {
    "source_kind": "local_fixture",
    "source_id": "fixture-demo-1",
    "collected_at": "2026-10-10T10:00:00Z"
  },
  "operational_effects": 0
}
